YouTube,status,name,track,day,organization,photo,linkedin,linkedin2,twitter,twitter2,title,abstract,description,bio
,confirmed,Roosevelt Elias,1,1,Payble Technologies,Roosevelt Elias.png,https://www.linkedin.com/in/rooseveltelias/,,RooseveltElias,,Reliability at the Edge: Building SRE Culture in Resource-Constrained Environments,"How do you build reliable systems where downtime is not just an inconvenience, but a threat to trust, income, and even safety? In this talk, Roosevelt Elias, founder of Payble, explores how to establish SRE principles in markets where infrastructure is unreliable, cloud access is intermittent, and talent pipelines are still emerging. Drawing from real-world experience building financial infrastructure in Africa, we’ll discuss culturally aware incident management, lightweight observability stacks, distributed troubleshooting with limited tooling, and what it means to bake resilience into the DNA of both product and process even when the odds are stacked against you.

This talk is ideal for SREs, platform engineers, and product leaders building for emerging markets or aiming to design more resilient systems globally.",,"Roosevelt Elias is a visionary solutions architect, product strategist, technology entrepreneur, and founder of Payble, a next-generation product technology company focused on solving complex economic and digital inclusion challenges for micro and small businesses across Africa and globally. With over a decade of experience spanning product design, payments, and creative technology, Roosevelt has built companies at the intersection of design, technology, and social impact. including a successful exit in the print media space and a thriving live-streaming SaaS business that has powered events for global artists and thought leaders.

A trained computer scientist with a background in IT Security, Roosevelt is passionately committed to creating tools that enable underserved businesses to thrive with the same capabilities as Fortune 500 enterprises, through intelligent systems, AI-driven insights, and user-first design. Under his leadership, Payble is redefining the role of financial technology, not just as a utility, but as an ecosystem that transforms local businesses into global players.

He is a bold thinker, deeply rooted in service, faith, and sustainable impact, building Payble to be a company that will outlive generations."
,confirmed,Ceyda Duzgec,1,1,Sufle,Ceyda Duzgec.png,https://www.linkedin.com/in/ceydaduzgec/,,,,Beginner's Guide to Terragrunt,"Why Terragrunt Matters If you've worked with Terraform in production, you've likely encountered the pain of managing multiple environments, duplicate configuration files, and complex remote state setups. Terragrunt solves these common Infrastructure as Code challenges by providing a thin wrapper around Terraform that promotes DRY (Don't Repeat Yourself) principles and simplifies configuration management.

What You'll Learn This talk will take you from Terragrunt zero to hero, covering: Foundation & Setup

What Terragrunt is and why it exists - Key differences between Terraform and Terragrunt - Installation and initial configuration

Pre-requisites: - Basic AWS knowledge - Basic Terraform knowledge",,"Ceyda serves as a Cloud and Platform Engineer at Sufle. She has previously worked as a Software Developer at different companies. She has experience particularly in technologies such as AWS, Kubernetes, and Python. She completed her Master's degree in Software Engineering at Boğaziçi University and graduated from Sabancı University with a Bachelor's degree in Computer Science and Engineering. She holds a HashiCorp Certified Terraform Associate certification and has been using Terraform and Terragrunt for big production workloads."
,confirmed,Mayank Goyal,1,1,Zoom,Mayank Goyal.png,https://www.linkedin.com/in/goyalmayankk/,,goyalmayankk,,Kepler - Optimized power usage monitoring for Kubernetes,"Sustainability is increasingly becoming a priority in the Information Technology sector, which has fueled the demand for energy-efficient solutions in all computing environments. Effective management of resources in Kubernetes environments requires proper monitoring and optimisation of power usage. Kepler (Kubernetes-based Efficient Power Level Exporter) solves this problem by offering a solid solution for energy monitoring at the pod level. Using software counters, tailored machine learning models, and the Cloud Native benchmark suite, Kepler provides accurate energy consumption estimations and detailed reports on power usage. Developers and system administrators can thus make informed choices towards environmentally friendly and energy-efficient Kubernetes operations.",,"Mayank Goyal is a Senior Site Reliability Engineer at Okta, specialising in maintaining Workflows systems' scalability and reliability. Before working at Okta, he honed his DevOps & Software engineering skills at Zoom and RedHat, where he grew deeply passionate about automation. While at RedHat, he was instrumental in automating and configuring the Release Pipeline in RHELWF. Apart from his professional obligations, Mayank is a passionate supporter of open-source technologies and likes being on the cutting edge. He loves connecting with the technology community, exchanging thoughts, and learning from others."
,confirmed,Jorge Lainfiesta,1,1,Rootly,Jorge Lainfiesta.png,https://www.linkedin.com/in/jrlainfiesta/,,,,Driving Platform Adoption with Embedded SREs,"Platform engineers work hard to build great tooling and automations for developers, but often struggle to get feature teams to adopt the platform to its full potential. Meanwhile, SREs are buried in incident firefighting and can’t keep up with onboarding new services or proactive reliability initiatives.

Turns out these two challenges could be solved by tackling them together. In this talk, we’ll share how we combined platform engineering and SRE into one hybrid responsibility that doesn’t just ship tooling, it helps teams actually adopt it.

We’ll show how our Platform SREs make new services “reliable by default” with out-of-the-box observability, alerts, and SLOs.

But for those older, messier services? We send someone in. Embedded SRE style, but for a limited time and scope.

We’ll walk through how we structure these short-term embed missions, what’s worked (and what’s flopped), and how this helped adoption go way up without burning anyone out. If you’re tired of begging teams to migrate or your SREs are on the verge, this one’s for you.",,Jorge is a Reliability Advocate at Rootly and the author of the Linux Foundation Introduction to Backstage (LFS142) course. He has a background in software engineering (ex-PayPal) and digital communication (UCLA). He's also a certified sommelier (CETT Barcelona).