YouTube,status,name,co-speaker,track,day,organization,photo,linkedin,linkedin2,twitter,twitter2,title,abstract,description,bio
,a keynote,Alayshia Knighten,,,,Freelance,Alayshia Knighten.png,https://www.linkedin.com/in/alayshia/,,,,Keynote: Supercharging Observability with Feature Flagging,"Feature flags allow you to enable and disable code without changing or deploying any source code, as well as letting you selectively route traffic to certain users or a percentage of certain users, along with other great tricks. It’s powerful stuff … but when you combine it with observability (the ability to understand the inner workings of your complex systems and other unknown-unknowns), what you get is a supercharged, superpowered version of both.
With observability and feature flags, you and your teams get deep technical and business insights in real time about how your code is working, what changed with your last deploy, and how changes are impacting different users, apps, or groups.",,
,a keynote,Joyce Lin,,,,Postman,Joyce Lin.png,https://www.linkedin.com/in/joyce-lin/,,@PetuniaGray,,Keynote: Developers are all the same,"We know that developers are not all the same. But wait, they kind of are. This talk shares lessons learned from 20+ million developers to help SREs better engage with application developers.",,
,a keynote,Miko Pawlikowski,,,,SRE Author,Miko Pawlikowski.png,https://www.linkedin.com/in/mikolajpawlikowski/,,@mikopawlikowski,,Keynote: The state of SRE in 2023,"Come and explore the landscape of SRE as it is in 2024, with the new trends, techniques and tools on the horizon.",,
,confirmed,Aleksei Popov,,,,Stenn International,Aleksei Popov.png,https://www.linkedin.com/in/aleksei-popov-771b34233/,,,,Architecture of a Fintech Startup: Tackling Growing Complexity at Scale,"Comprehensive overview of various aspects of building a highly scalable fintech startup with a product-led strategy. In this talk, Aleksei Popov shares insights on different problems and solutions for tackling the inevitable growing complexity during the scaling of a fintech startup. He will also discuss the role of technology in enhancing customer experience and streamlining operations.",,"Alex is a dedicated Software Engineering Manager with a specialization in the .NET environment and software architecture. Currently serving as the Engineering Lead at a prominent fintech company in London, Alex has led the development and deployment of critical products that have made significant impacts on the fintech landscape. His initiatives have directly led to the enhancement of payment systems, the introduction of innovative financial solutions, and the strengthening of security measures. These contributions have not only propelled the company's growth but have also set new standards in the industry."
,confirmed,Andrei Kvapil,,,,Flant,Andrei Kvapil.png,https://www.linkedin.com/in/kvaps/,,kvaps,,"Mastering Metal: Our Journey to Stable, Reproducible Infrastructures with Talos Linux and Cozystack",How to deploy a reproducible environment on bare metal with Talos Linux. Our experience in developing an open platform designed for on-premise. How we ensure component stability on any hardware.,,"Linux and Open Source fanboy. Developer Advocate and crazy idea generator.
I like to find non-standard solutions and promote them to the community.

Over the years, I've gathered a lot of experience with free virtualization platforms and software-defined storage.
Currently, most of the technologies I work with are Kubernetes, LINSTOR and KubeVirt."
,confirmed,Andreia Otto,,,,adidas,Andreia Otto.png,https://www.linkedin.com/in/andreia-otto/,,,,Navigating the Transition: SRE Challenges and Highlights in Shifting from Monolith to Microservices at adidas e-commerce,"Explore adidas e-commerce's shift from monolithic to microservices in this talk. Uncover the challenges and insights faced by SREs – from scalability to incident response. Join us for practical lessons, best practices, and success stories navigating SRE in the microservices era.",,"Andreia Otto, leading the adidas Digital SRE team. Hailing from Brazil and now residing in Germany, she oversees the reliability of adidas e-commerce. Implementing DevOps practices and SRE principles daily, Andreia ensures seamless operations in the dynamic world of digital commerce. 
When not working, she is usually outdoors with her dogs or eating cheesecake with a cup of coffee!
"
,confirmed,Anthony Ekpechue,,,,Globallogic,Anthony Ekpechue.png,https://www.linkedin.com/in/anthonyekpechue/,,,,Adopting Zero-Trust Security Strategy in Serverless application Deployment,Zero Trust Security Framework deployed as guardrails to verify every request as if it originates from an open network and anticipates that threats can be both internal and external using Enterprise Solutions like Hashicorp Sentinel and Open-source tools like Kyverno and Open Policy Agent.,,"My name is Anthony Ekpechue, and I work for Globallogic UK&I as a Lead Cloud Delivery Consultant. I have several years of experience as a DevOps Engineer and have a track record of delivering cloud solutions, with a focus on cloud adoption and migrating from monolithic to microservice architecture. I have also successfully implemented Zero Trust Solution across serverless workloads in a multi-tenant environment."
,confirmed,Antonio Cobo Cuenca,,,,Contino,Antonio Cobo Cuenca.png,https://www.linkedin.com/in/antoniocobocuenca/,,@Mind_of_AC,,From Hero to Zero: practical guide to destroy your best employees,"All of us have attended lots of talks with the premise “from Zero to Hero…”, but what does it take for a real Rock Star, a real Ninja, a magical Unicorn, a superhero to become a complete Zero?

How can we destroy those heroes in a way that every supervillain on every film has dreamt about every day?",,"Antonio is an Agile enthusiast with more than 20 years experience in the IT industry and specialises in Agile methodologies. He comes from a technical background, starting his career as a Java Developer in Spain in 2000, moving to different roles within IT in three different countries. Antonio is passionate about creating and implementing the best solution while continually seeking to improve work methodologies. He is convinced that most of the problems in IT are due to lack of communication! He usually speaks about Agile, DevOps,Team management and mental health at conferences across Europe and US, such as DevOps Days,  Agile Tour, JSConf, Codemotion and Voxxed Days."
,confirmed,Carlo Ventrella,,,,Agilelab,Carlo Ventrella.png,https://www.linkedin.com/in/carlo-ventrella-02752b71/,,,,A multi-environment deployment strategy for a Kubernetes-based microservice architecture.,"Imagine a product made of a number of microservices on Kubernetes and dozens of devs working on them. Now imagine multiple environments, where they must be deployed, tested and demoed at the speed of light.
Let's put all of this together in a design that satisfies devs, customers and SRE's nights!",,
,confirmed,CostaTsaousis,,,,Netdata,CostaTsaousis.png,https://www.linkedin.com/in/costatsaousis/,,@CostaTsaousis,,Practical AI with Machine Learning for Observability in Netdata,"In SreCON19, Todd Underwood from Google gave a presentation with the title “All of Our ML Ideas Are Bad (and We Should Feel Bad)”. Let’s see a few ML ideas, implemented in the open-source Netdata, that may not actually be that bad.",,"Hi! I am Costa Tsaousis, the Founder and CEO of Netdata. Since 1995, I have been actively working on internet related startups. I have been a co-founder and C-level executive of many successful projects, including Internet Service Providers, Cloud Hosting Providers and Fintech startups. I have a passion for innovation and open-source and I now lead Netdata, a monitoring solution aiming to simplify and modernize infrastructure observability for all of us.

I am a cat person and we have a whole tribe of them at the office constantly walking on our keyboards. We try to keep them out of the room when we are pressing the release button ;) "
,confirmed,Dave McAllister,,,,NGINX,Dave McAllister.png,https://www.linkedin.com/in/davemc/,,@dwmcallister,,The Subtle Art of Lying with Statistics,"Lies, damned lies and statistics. But statistics allow you to lie to yourself. Statistics can trick us into believing things that are less than true, though not on purpose. Learn how data choice, event focus and scale change perspective.  See how graphs mislead and correlation can cause confusion.",,"Currently providing technical evangelism for NGINX, Dave works with DevOps, developers and architects to understand the advantages of modern microservice architectures and orchestration to solve large-scale distributed systems challenges, especially with open  source and  its innovation. Dave has been a champion for open systems and open source from the early days of Linux, through open distributed file systems like XFS, GFS, and GlusterFS to today's world of clouds and containers. He often speaks on topics such as the real-world issues associated with emerging software architectures and practices, on open source software and on creating new technology companies. 

Dave has spoken on technical topics like distributed request tracing, modern monitoring practices, open sources projects from both corporations and foundation views, and  on how open source innovations powers todays world.

Dave was named as one of the top ten pioneers in open source by Computer Business Review, having cut his teeth on Linux and compilers before the phrase ""open source"" was coined. Well versed in trivia, he won a Golden Penguin in 2002.  When he's not  talking, you can find him hiking with his trusty camera, trying to keep up with his wife.
"
,confirmed,Diana Todea,,,,Elastic,Diana Todea.png,https://www.linkedin.com/in/diana-todea-b2a79968/,,,,Generative AI: bliss or miss?,We all have been mesmerised by GenAI's powers. How does GenAI blend in the SRE context? Would it be a pillar to a stronger SRE type? A new GenAI+SRE genetics? Well it might be just a fantasy until we actually practice with it and apply it in the real world.,,"Diana is a Site Reliability Engineer at Elastic and she focuses on Observability. She is passionate about serverless, generative AI and machine learning."
,confirmed,Erwin de Keijzer,,,,Fullstaq,Erwin de Keijzer.png,https://www.linkedin.com/in/erwindekeijzer/,,,,"A deep dive into Perses, the GitOps Native dashboard visualization tool","Perses is to Prometheus as what Grafana was for graphite. And even though Grafana has become so much more, Perses is an extremely interesting new entry into the dashboad/visualisation space. This talk will have an up to date demo and some of the unique advantages Perses offers over alternatives.",,"Erwin is a DevOps Engineer at Fullstaq. He loves educating people what it means to build cloud native applications (and it’s not just using the “cloud”). Using the Cloud Native landscape to make application delivery and lifecycle simple and reliable. At home he is always looking for sidequests; monitoring his power usage to send notifications when his washing machine is done, connecting the garage door to the internet (securely) and adding music to his elevator are just a few examples. His experience makes him a very practical engineer, finding the simple solution is more important than having a modern, shiny solution."
,confirmed,George Lestaris,,,,Google,George Lestaris.png,https://www.linkedin.com/in/glestaris/?originalSubdomain=uk,,,,How Google SRE and developers work together,"SRE are Google's specialists for designing, building, and running complex services that are reliable, scalable, efficient, and maintainable. The SRE Engagement Model describes how the collaboration between developers and SREs works and how reliability engineering can be applied early in development.",,"George is a Site Reliability Engineer (SRE) currently working as a technical lead for the Google Ads SRE team in London, UK. With a background in software engineering and product management, he is passionate about understanding all aspects of tech product development and developer productivity.

Prior to joining Google, George gained valuable experience through his work at CERN, Pivotal, and startups, where he gained expertise in virtualization, Cloud Foundry PaaS, on-prem Kubernetes, and Python app development. He has also had the opportunity to share his knowledge at conferences such as PyCon UK, Cloud Foundry Summits, Open Source Summits, and computing for high-energy physics conferences (CHEP)."
,confirmed,Harel Safra,,,,Riskified,Harel Safra.png,https://www.linkedin.com/in/harelsafra/,,,,When Infrastructure as Code Ends - Jump in and Create Some More,"Adding new functionality to Terraform can be daunting: it’s written only in Go (which you may not know) and you have to understand the architecture and work through less than welcoming documentation. I’ll provide a walkthrough from my experience with it, going from zero to publishing a provider.",,"Harel Safra is a Data Platform Engineering Team Lead at Riskified, a Fintech company focusing on fraud prevention. His team manages the online data platform supporting real time fraud detection systems.
He has worked in various Data And Infrastructure roles throughout his career, always striving for simpler ways to achieve scalable, optimally performing systems
"
,confirmed,Jorge Luis Castro Toribio,,,,NTT DATA,Jorge Luis Castro Toribio.png,https://www.linkedin.com/in/jorgeluiscastrotoribio/,,,,Navigating the Path to Reliability: Crafting an SRE Roadmap for Enterprise Success,"If you need to define a road map to build more reliable products through SRE building ways of workign adoption, you need to make an strategy to have a solid why and a road map to reah outcomes itertively while you follow SRE road map adoption at your company, in this talk we share a real experience",,"Jorge is an agilist, Agility & Digital Transformation Lead Coach, QA Manager, DevOps Program Manager, and global speaker who feels passion for Testing Automation, Agile, DevOps and business agility. He enjoys research and learning about business agility and working with cutting-edge technologies. He has been learning continuously for more than 12 years and is still learning new ways to foster enterprise agility and team greatness. He has worked in several roles (developer, tester, IT program manager, Software engineering in Test manager, QA manager, agile coach) which helps him to see the big picture and operational and team members dynamics happening inside organizations. This experience lets him help teams design, build, and implement digital, DevOps and agile transformation strategies. He encourages focus on: People, Productivity, Continuous improvement, Innovation and having fun to enjoy success in our agile journeys.
Jorge has been a speaker in Agile and DevOps events organized in Peru, Canada, UK, Netherlands, India, Germany, Mexico, Colombia, Nigeria, Panama, Azerbaijan, Australia, US among other countries."
,confirmed,Justin Garrison,,,,Sidero Labs,Justin Garrison.png,https://www.linkedin.com/in/justingarrison/,,@rothgar,,Declarative Linux with the Common Operating System Interface,We run declarative systems built on top of an imperative operating system. It’s time we simplified our interface for Linux with a declarative API.,,"Justin is the director of developer relations at Sidero Labs. He helps companies simplify their Kubernetes and Linux infrastructure. He previously helped create Oscar winning movies at Disney, built infrastructure for Disney+, and improved Amazon EKS as part of the product team. In his spare time he builds modern-retro computers and streams Moana on repeat."
,confirmed,Marcin Szymaniuk,,,,TantusData,Marcin Szymaniuk.png,https://www.linkedin.com/in/marcin-szymaniuk/,,,,"ChatGPT, LLMs, and LangChains - A Beginner's Guide","Would you like to do something more than just create prompts for ChatGPT? How about building an application? An application that utilises the power of generative AI. From scratch! All you need is Python knowledge, your laptop, and an open mind.
We will cover the tricky bits and pitfalls as well!",,"Specialising in monetising big data for clients since the 07's, Marcin is leading a team of seasoned data engineers specialised in everything data: Data Engineering, ML, ML-ops, and Cloud. Marcin is an expert in non-standard issues and those more run-down-the-mill that must be solved quickly and conveniently. His experience spans industries and various project sizes. But his speciality remains the area of AI, Ml and deployment. Marcin's professional journey boasts collaborations with industry titans such as Apple, Spotify and Telia, as well as, nurturing startups. Such rich expertise makes him an excellent speaker."
,confirmed,Marcos Diez,,,,Modus Create,Marcos Diez.png,,,,,"Kubernetes, AWS, ALBs, Terraform and no Helm!","You will see the advantages of using the k8s provider for terraform instead of helm to manage the k8s objects (""yamls""). It allows you to see and confirm exactly what changes will happen in your cluster. Later we'll see how to integrate that with the AWS ALB and forward traffic directly to pods.",,"Bachelor in Computer Science, open source developer (some apps with more than 100k downloads), has experience working in Germany, Switzerland and United States, AWS Certified and currently working full time as DevOps. I have a reasonable number of open source contributions, including more than 20 to the k8s dashboard, 
ansible, terraform, AWS Load Balancer Controller for k8s, minikube and fluentd."
,confirmed,Matteo Bianchi,,,,Omnistrate,Matteo Bianchi.png,https://www.linkedin.com/in/mbianchidev/,,,,"Oops, I deployed too hard","Sometimes you delete production, you drop tables, you change a conf and everything breaks but what if you upgraded the wrong environment, to the wrong version, of the wrong customer (that also happens to be the bigger your company has)?

And what if you did it right before going to a long lunch?

This is a tale of compliance, regulations, unauthorized deployments and ethical questions!
Solved more through diplomacy than with coding.
Memes included*",,
,confirmed,Michael Cote,,,,VMware / Pivotal,Michael Cote.png,https://www.linkedin.com/in/michaelcote/,,cote,,Developer productivity is waste,"We're developer productivity obsessed, worse, developer productivity METRICS obsessed. Deployment frequency! MTTR! eNPS! It's become a delightful distraction. Besides, who really benefits from this focus? This talk makes the case that we should focus more on actual craft and less on metrics.",,"[Michael Coté](https://cote.io/) studies how large organizations get better at building software to run better and grow their business. His [books](https://cote.io/books/) [_Changing Mindsets_](https://www.oreilly.com/library/view/changing-mindsets-the/9781098105839/?utm_source=cote&utm_campaign=devrel&utm_content=bioblock), [_Monolithic Transformation_](https://tanzu.vmware.com/content/ebooks/monolithic-transformation?utm_source=cote&utm_campaign=devrel&utm_content=bioblock), and [_The Business Bottleneck_](https://content.pivotal.io/ebooks/the-business-bottleneck?utm_source=cote&utm_campaign=devrel&utm_content=bioblock)_ cover these topics. He's been an industry analyst at RedMonk and 451 Research, done corporate strategy and M&A, and was a programmer. He also co-hosts several podcasts, including [Software Defined Talk](https://www.softwaredefinedtalk.com/). His daily-ish newsletter is at [newsletter.cote.io](https://newsletter.cote.io/)."
,confirmed,Nishkarsh Raj,,,,StatusNeo,Nishkarsh Raj.png,https://www.linkedin.com/in/nishkarshraj/,,@NishkarshRaj1,,Accelerating Developer Experience with Backstage,"The session would focus on the importance of Engineering Portals to accelerate Developer Experience by letting them ""Create"" Reusable Patterns, ""Manage"" their software catalog in a centralized inventory, and  ""Explore"" the software ecosystem in a unified Single Pane of Glass.",,"Nishkarsh is a DevSecOps expert and an International GitHub Star. Nishkarsh is an ardent supporter of open-source, GitHub, DevEx, and DevOps. Nishkarsh serves as StatusNeo Inc.'s Principal Evangelist & Consultant. Over the years, he has been actively GitHubbing and contributing to open-source. By giving talks at conferences, organizing meetups, and encouraging people to take on the #100DaysofCode challenge, he has encouraged many brilliant minds to embark on their journeys in open-source projects and preach the significance of collaboration to aspiring developers."
,confirmed,Oleg Fatkhiev,,,,,Oleg Fatkhiev.png,https://www.linkedin.com/in/ofats/,,,,Config files vs. flags: story of pain,"Have you encountered a project where every single app reads a config file on startup? Have you struggled to find those files or change them?

Did you feel that there is something off with this approach?

Look no further! We will discuss when flags can solve all of these issues (and when they can't).",,I'm Oleg. I like memes.
,confirmed,Ondrej Babec,Jiri Novotny,,,Red Hat,Ondrej Babec & Jiri Novotny.png,https://www.linkedin.com/in/ondrej-babec/,https://www.linkedin.com/in/ji%C5%99%C3%AD-novotn%C3%BD-294915202/,@OBabec,,Debezium Server - New CDC runtime on the horizon!,Discover Debezium: Real-time database change streaming made seamless. Say goodbye to vendor lock-in with the innovative Debezium Server. Learn about parallelization and Kubernetes deployment using the Debezium Operator and supercharge your application performance.,,"# About me

My name is Ondrej, and I am passionate about almost everything related to IT. I spend most of my free time watching, fixing, or driving cars, so we will have a lot to talk about if you are a car or bike person.

Besides that, I have a beard and am pretty tall, so I suppose I am easy to find. I am open to conversing with anyone, learning something new, or giving anybody some advice.

## Career
I have been working in **Red Hat** as a Senior Quality Engineer and Team Lead for almost 6 years now on various projects: 
* Enmasse 
* PatrIoT 
* Apicurio Registry
* Debezium

Currently, I have two main projects that I am interested in:
* **[Debezium project](https://github.com/debezium)**, which I find very interesting, and I love working with the whole community around it. 
* **[Skodjob project](https://github.com/skodjob)**: this project was created some years ago by my colleagues David Kornel and Jakub Stejskal. It contains various tooling for long-running test environments on the Openshift environment and database performance tooling.

Other than that, I am still trying to find time to work on some of my older projects, like Rust MQTT, the first Async Rust MQTT client for embedded devices at the time."
,confirmed,Ricardo Castro,,,,FanDuel/Blip.pt,Ricardo Castro.png,https://www.linkedin.com/in/mccricardo/,,@mccricardo,,DevOps Is Not Dead. Not Not by a Long Shot,"DevOps is not a trend that has come and gone. It's a cultural shift that has fundamentally changed how software is developed and deployed. While emerging practices like Platform Engineering may seem to be taking over, they are not meant to replace DevOps; instead, they are complementary to it.",,"Principal Engineer, SRE at FanDuel/Blip.pt. MSc in Computer Science by the University of Porto. CK{AD, A, S} by Cloud Native Computing Foundation (CNCF) | Linux Foundation. {Terraform, Consul, Vault} Associate by HashiCorp. Working daily to build high-performance, reliable and scalable systems. DevOps Porto meetup co-organizer and DevOpsDays Portugal co-organizer. A strong believer in culture and teamwork. Open source passionate, martial arts amateur, and metal lover."
,confirmed,Richard Finlay Tweed,,,,Thought Machine,Richard Finlay Tweed.png,https://www.linkedin.com/in/richardftweed/,,,,"Using, and mis-using Kubernetes Dynamic Admission Control","Kubernetes Dynamic Admission control can be used for advanced validation and error correction of workloads. 
If you've ever wanted to make sure workloads in your clusters are conforming to security best practices, this talk will show you how!",,"Richard Tweed is a Kubernetes specialist at Thought Machine. Over the last five years he has been ensuring security, scalability and compliance across all major Kubernetes cloud platforms. He's also the lead maintainer of kube-audit-rest"
,confirmed,Simon Hanmer,Ross Walker,,,GlobalLogic,Simon Hanmer & Ross Walker.png,https://www.linkedin.com/in/simonhanmer/,https://www.linkedin.com/in/ross-walker-4b1653163/,@simonhanmer,,Mystery of the disappearing S3 Keys,"Imagine a system designed to process millions of events per day, but as use grows, data mysteriously seems to disappear, only to re-appear later. We’ll talk about the what, why and how we investigated the symptoms, overturned some assumptions and finally delivered a resilient, serverless solution",,"Starting out in a very traditional background in the data-centres of the fabled M4 corridor, Simon eventually realised it was time to give up on the problems of manually babysitting servers, racks and UPS's and migrated to the Cloud (and in the process, the Scottish Highlands) and now works to enable clients to transition their workloads, processes and swag requirements to the same route.

Simon is a member of the AWS Community builder program, and these days enjoys coaching and mentoring as much as get hands-on with code, automation and head-scratching."
